id;genres;keywords;original_title;runtime;vote_average;vote_count;director
16620;Drama Music;musical death dying young nostalgic mexican american;La Bamba;108.0;6.8;116;Luis Valdez
25113;Comedy Drama Romance;;The Four Seasons;107.0;6.3;16;Alan Alda
11033;Horror Mystery Thriller;transvestism taxi prostitute subway shower;Dressed to Kill;105.0;6.8;157;Brian De Palma
34723;Action Adventure Drama Family;southern accent wanted man lynch mob reflection in water lesson;The Adventures of Huck Finn;108.0;6.2;42;Stephen Sommers
9430;Crime Comedy Thriller;ecstasy drug dealing drug reference to family circus high;Go;98.0;7.0;196;Doug Liman
8998;Comedy Drama Romance;midlife crisis marriage money divorce fashion;Friends with Money;88.0;5.1;128;Nicole Holofcener
10514;Science_Fiction Thriller;nasa new mexico biological weapon epilepsy secret lab;The Andromeda Strain;131.0;7.0;190;Robert Wise
10496;Horror Thriller;mutation bat attack closed mine bat attack;Bats;91.0;4.1;35;Louis Morneau
1591;Drama;loss of family emigration world war ii jew national socialism;Nirgendwo in Afrika;140.0;7.0;32;Caroline Link
76025;Drama;pornography brother sister relationship sex addiction new york city thirty something;Shame;100.0;7.0;875;Steve McQueen
4836;Drama Thriller Crime;kidnapping ecstasy drug traffic drug mule hitman;Layer Cake;105.0;7.0;559;Matthew Vaughn
14631;Drama;;The Work and the Glory II: American Zion;100.0;8.0;6;Sterling Van Wagenen
87499;Drama Thriller;secret organization murder environmentalism vanity film eco-terrorists;The East;116.0;6.5;305;Zal Batmanglij
18923;Romance Drama;gay aids based on novel art house tantrum;A Home at the End of the World;96.0;6.8;45;Michael Mayer
26665;Drama Comedy Foreign;alcohol cocaine daughter road trip independent film;Aberdeen;113.0;7.0;6;Hans Petter Moland
28089;Drama History;independent film wounded soldier iraq war;The Messenger;113.0;7.1;119;Oren Moverman
62255;Action Drama Thriller Adventure;;Tracker;102.0;6.0;16;Ian Sharp
5708;Drama;manchester city medicine new love epilepsy wife;Control;121.0;7.5;200;Anton Corbijn
218;Action Thriller Science_Fiction;saving the world artificial intelligence rebel cyborg shotgun;The Terminator;108.0;7.3;4128;James Cameron
338;Comedy Drama Romance;bureaucracy berlin wall police state coma loss of mother;Good bye, Lenin!;121.0;7.4;586;Wolfgang Becker
21641;Drama;england leeds united sport brighton soccer;The Damned United;97.0;7.2;152;Tom Hooper
10925;Comedy Horror;female nudity crematorium nudity punk company;The Return of the Living Dead;91.0;7.3;267;Dan O'Bannon
2293;Romance Comedy;sex game show slacker shopping mall;Mallrats;94.0;6.8;392;Kevin Smith
621;Romance;flying car street gang running graduation musical;Grease;110.0;7.2;1581;Randal Kleiser
792;Drama War Action;famous score hero mine vietnam war village;Platoon;120.0;7.5;1205;Oliver Stone
642;History Drama Western Crime;wyoming historical figure loot sharing;Butch Cassidy and the Sundance Kid;110.0;7.4;650;George Roy Hill
433;Comedy Family Fantasy;london england dancing parents kids relationship bank brother sister relationship;Mary Poppins;139.0;7.4;1183;Robert Stevenson
16619;Drama;post traumatic stress  disorder depression suicide attempt grief dysfunctional family;Ordinary People;124.0;7.4;145;Robert Redford
1725;Crime Drama Music;slum street gang love at first sight showdown puerto rican;West Side Story;152.0;7.0;389;Robert Wise
11977;Comedy;golf underwear sport golf course gopher;Caddyshack;98.0;6.6;365;Harold Ramis
20322;Comedy Drama Romance;independent film track and field gangster rap;The Brothers;106.0;6.5;10;Gary Hardwick
16158;Comedy Drama Romance;;The Wood;106.0;7.1;34;Rick Famuyiwa
629;Drama Crime Thriller;law relatives theft criminal criminal mastermind;The Usual Suspects;106.0;8.1;3254;Bryan Singer
10160;Horror Thriller;nun baby monster asylum nightmare;A Nightmare on Elm Street 5: The Dream Child;89.0;5.5;245;Stephen Hopkins
11452;Comedy Romance;male nudity female nudity sex college locker room;National Lampoon’s Van Wilder;92.0;5.9;858;Walt Becker
12163;Drama Romance;supermarket heart attack ambition daughter wrestling;The Wrestler;109.0;7.3;1000;Darren Aronofsky
32275;Western;half breed;Duel in the Sun;144.0;6.2;37;King Vidor
13785;Comedy;illinois pet shop poodle independent film mockumentary;Best in Show;90.0;6.7;166;Christopher Guest
1103;Science_Fiction Action;taxi street gang usa president war veteran hostage;Escape from New York;99.0;6.9;703;John Carpenter
36739;Comedy Drama;musical;School Daze;121.0;6.2;26;Spike Lee
14144;Comedy Family;competition grandfather grandson relationship vomit summer camp toilet;Daddy Day Camp;89.0;4.4;91;Fred Savage
10622;Crime Action Comedy;journalist martial arts cook drug dealer;一個好人;113.0;6.3;128;Sammo Hung
13370;Comedy Music;mockumentary folk singer;A Mighty Wind;91.0;6.6;74;Christopher Guest
11191;Comedy Drama Romance;independent film commitment lobster portuguese american;Mystic Pizza;104.0;5.9;123;Donald Petrie
10215;Comedy Drama Fantasy Romance;double life commercial fantasy chance marketing;Sliding Doors;99.0;6.5;354;Peter Howitt
25066;Crime Horror Thriller;prison child abuse ku klux klan police brutality ghetto;Tales from the Hood;98.0;5.4;32;Rusty Cundieff
1523;Drama;dictator 1970s general kidnapping naivety;The Last King of Scotland;121.0;7.4;558;Kevin Macdonald
11361;Horror Thriller;sheriff barn black sequel boogeyman;Halloween 5: The Revenge of Michael Myers;96.0;5.2;183;Dominique Othenin-Girard
92591;Comedy Crime Drama;prison visit funeral director funeral home amateur theater embezzlement;Bernie;100.0;6.5;320;Richard Linklater
57612;Documentary;dolphin whale killer whale imax 3d;Dolphins and Whales: Tribes of the Ocean;42.0;8.0;3;Jean-Jacques Mantello
12509;Drama Romance;artist success relationship problems alcoholism independent film;Pollock;122.0;6.6;91;Ed Harris
15256;Comedy Drama Romance;new year's eve independent film relationship woman director lower east side;200 Cigarettes;101.0;6.1;44;Risa Bramon Garcia
83686;Drama Thriller;plagiarized book stolen novel plagiarized novel aspiring writer;The Words;96.0;6.4;379;Brian Klugman
80304;Comedy Western;mexico organized crime drug lord padre aftercreditsstinger;Casa De Mi Padre;84.0;5.5;103;Matt Piedmont
28053;Drama Comedy;secret fetishism stripper family secrets convict;City Island;104.0;6.9;113;Raymond De Felitta
67913;Action Comedy Thriller Crime;prostitute blackmail drug smuggle rural ireland dry humour;The Guard;96.0;6.8;372;John Michael McDonagh
13991;Comedy;sexuality college girlfriend vomit celebration;College;94.0;4.8;48;Deb Hagan
1443;Drama Romance;michigan 1970s youth family woman director;The Virgin Suicides;97.0;7.1;817;Sofia Coppola
8545;Comedy Drama;parents kids relationship voice loneliness independent film singer;Little Voice;97.0;6.6;61;Mark Herman
19556;Comedy Romance;sex first time virgin road trip playboy;Miss March;89.0;5.4;77;Zach Cregger
231576;Drama Comedy;jew independent film homeschooling family struggling actor;Wish I Was Here;120.0;6.4;300;Zach Braff
16172;Comedy;restaurant department store kitchen love crab;Simply Irresistible;95.0;5.5;52;Mark Tarlov
13403;Comedy Music;transvestism gay sex singer transgender;Hedwig and the Angry Inch;95.0;7.4;80;John Cameron Mitchell
15797;Action;;Only the Strong;99.0;6.9;29;Sheldon Lettich
347764;Mystery Drama Thriller Horror;;Goddess of Love;96.0;6.2;9;Jon Knautz
13537;Drama History;;Shattered Glass;94.0;6.6;111;Billy Ray
20794;Comedy Crime Thriller;murder independent film drug dentist;Novocaine;95.0;6.0;44;David Atkins
576;Adventure Western;underdog robbery bounty hunter texas mexican revolution;The Wild Bunch;145.0;7.6;259;Sam Peckinpah
13990;Drama;coming of age marijuana summer;The Wackness;99.0;6.2;94;Jonathan Levine
11583;Thriller Adventure Drama Crime;public hanging strongbox gold theft british history historic figure;The First Great Train Robbery;110.0;6.6;74;Michael Crichton
18602;Drama;independent film woman director;Morvern Callar;97.0;7.2;34;Lynne Ramsay
27549;Action Adventure Fantasy Science_Fiction;based on novel time travel sequel psychotronic sword and sandal;Beastmaster 2: Through the Portal of Time;107.0;4.6;17;Sylvio Tabet
59728;Drama;american football loss of brother funeral sport prayer;The 5th Quarter;97.0;4.7;12;Rick Bieber
10930;Drama;return suppressed past bourgeoisie mayor elections suspense;La fleur du mal;104.0;5.7;10;Claude Chabrol
32395;Drama;woman director;The Greatest;99.0;6.2;34;Shana Feste
58882;Drama History;fan duringcreditsstinger;Snow Flower and the Secret Fan;104.0;5.3;22;Wayne Wang
7547;Drama Romance;bar motel one-night stand beer blonde;Come Early Morning;97.0;5.9;10;Joey Lauren Adams
35944;Action Comedy;;Lucky Break;107.0;6.5;11;Peter Cattaneo
42222;Drama;friends playwright;Julia;117.0;6.3;30;Fred Zinnemann
13827;Comedy;surfing sport;Surfer, Dude;85.0;4.7;25;S.R. Bindler
44260;Documentary;;Lake of Fire;152.0;8.0;10;Tony Kaye
9282;Crime Drama Thriller;alcohol sex robbery secret gun;11:14;86.0;6.8;206;Greg Marcks
38940;Action Thriller;asia island mercenary independent film jungle;Men of War;103.0;5.4;29;Perry Lang
35689;Crime Mystery Thriller;independent film;Don McKay;87.0;5.4;21;Jake Goldberger
97614;Crime Drama Thriller;partner murder on the run fugitive crime;Deadfall;95.0;5.6;224;Stefan Ruzowitzky
37206;Drama Family;orphan rainbow;A Shine of Rainbows;101.0;6.3;14;Vic Sarin
58626;Action Thriller;;The Hit List;90.0;5.2;73;William Kaufman
183894;Romance Comedy Drama;;Emma;240.0;7.6;38;Jim O'Hanlon
837;Horror Mystery Science_Fiction;suicide tv show hallucination tv station radio presenter;Videodrome;87.0;7.1;454;David Cronenberg
1555;Drama Comedy Romance;paris barcelona spain alcohol roommate single;L'Auberge espagnole;122.0;7.0;266;C\u00e9dric Klapisch
244783;Drama;woman director;Song One;86.0;5.5;87;Kate Barker-Froyland
16564;Drama History War;netherlands world war ii;Oorlogswinter;103.0;6.8;66;Martin Koolhoven
168027;Comedy;bomb squad ex-fugitive freaky;Freaky Deaky;90.0;4.9;18;Charles Matthau
3482;Action Drama Thriller War;paris france world war ii nazis hijacking of train;The Train;133.0;7.2;72;John Frankenheimer
8982;Action Crime Drama Thriller;buddhism elephant sydney australia fighter;ต้มยำกุ้ง;108.0;6.8;167;Prachya Pinkaew
89861;Comedy;italy victorian england young woman;Stiff Upper Lips;99.0;10.0;1;Gary Sinyor
455;Comedy Drama Romance;london england tradition indian lead culture clash immigration;Bend It Like Beckham;112.0;6.2;578;Gurinder Chadha
57022;Drama;independent film;Sunshine State;141.0;6.0;10;John Sayles
14351;Action Adventure Drama;street gang black people sport high school sports;Crossover;95.0;4.2;10;Preston A. Whitmore II
147767;Action Comedy;;Khiladi 786;139.0;4.7;11;Ashish R. Mohan
10664;Thriller Horror;religion and supernatural blood sample occult swat team gas mask;[REC]²;85.0;6.4;489;Jaume Balaguer\u00f3
55567;Comedy Music Family;;Standing Ovation;105.0;3.9;6;Stewart Raffill
9277;Comedy Crime Drama;chicago bet horse race repayment con man;The Sting;129.0;7.9;622;George Roy Hill
9443;Drama History;underdog scotland jewry patriotism olympic games;Chariots of Fire;123.0;6.8;207;Hugh Hudson
16186;Comedy Drama Romance;;Diary of a Mad Black Woman;116.0;6.4;71;Darren Grant
7863;Drama;letter jumping child prodigy pool pianist;Shine;105.0;7.3;131;Scott Hicks
138697;Romance Comedy Drama;pornography sex sex addiction male female relationship internet porn;Don Jon;90.0;5.9;1671;Joseph Gordon-Levitt
11901;Western;gunslinger desperation outlaw;High Plains Drifter;105.0;7.4;278;Clint Eastwood
1548;Comedy Drama;high school friends art class record collector plaster personal ad;Ghost World;111.0;7.1;426;Terry Zwigoff
11889;Drama Romance;based on novel new love love of one's life retiree aging;Iris;91.0;6.2;47;Richard Eyre
33155;Comedy Science_Fiction;android harley davidson cryogenics space travel love;Galaxina;95.0;3.3;16;William Sachs
5528;Drama;penalty choir diary musical boy's choir;Les Choristes;96.0;7.5;526;Christophe Barratier
321;Comedy Romance;gay father son relationship sex italo-american lovesickness;Mambo Italiano;92.0;5.6;28;\u00c9mile Gaudreault
4997;Crime Drama Mystery Thriller;robbery junkie investigation porno star murder;Wonderland;104.0;6.2;73;James Cox
925;Drama;black people italo-american police brutality sun glasses culture clash;Do the Right Thing;120.0;7.6;292;Spike Lee
27451;Drama;gambling sex college basketball mafia;Harvard Man;99.0;4.8;15;James Toback
73532;Drama Comedy;poverty policeman shoe shiner northern france;Le Havre;93.0;6.8;97;Aki Kaurism\u00e4ki
979;Drama Thriller Crime Mystery;paris prostitute rape sex nudity;Irréversible;97.0;7.1;538;Gaspar No\u00e9
193722;Comedy Drama;dominatrix bdsm;R100;100.0;5.4;31;Hitoshi Matsumoto
7913;Drama;new delhi india students' movement war of independence student celebration;Rang De Basanti;157.0;7.2;97;Rakeysh Omprakash Mehra
253253;Drama;;Animals;90.0;6.2;9;Collin Schiffli
51995;Comedy Thriller Action Drama;pastor church service spirituality religion;Salvation Boulevard;96.0;5.6;28;George Ratliff
13173;Comedy;independent film ventriloquist dummy multiple storylines sabbath brain scan;The Ten;96.0;4.9;57;David Wain
22908;Drama Comedy Foreign;rejection friendship youth;A Room for Romeo Brass;90.0;7.3;18;Shane Meadows
70670;Thriller Crime;death of lover art thief art gallery police investigation;Hodejegerne;100.0;7.1;399;Morten Tyldum
84204;Science_Fiction Comedy Thriller Horror;monster ireland drunk beheaded;Grabbers;94.0;6.0;140;Jon Wright
230266;Drama;love triangle love irish valet woman director;Miss Julie;120.0;5.9;45;Liv Ullmann
16633;Science_Fiction Drama Fantasy Romance;time travel playwright 1910s;Somewhere in Time;103.0;7.2;102;Jeannot Szwarc
63006;Drama Action Crime Foreign;goa drug bust rave party;Dum Maaro Dum;130.0;5.4;7;Rohan Sippy
91586;Horror Thriller;haunted house possession demon family ghost;Insidious: Chapter 2;106.0;6.5;1211;James Wan
215;Horror;riddle serial killer;Saw II;92.0;6.3;1251;Darren Lynn Bousman
333371;Thriller Science_Fiction Drama;kidnapping bunker paranoia basement survivalist;10 Cloverfield Lane;103.0;6.8;2468;Dan Trachtenberg
9012;Documentary Comedy;disgust pain stunts music video stuntman;Jackass: The Movie;87.0;6.1;345;Jeff Tremaine
345911;Horror Thriller;suicide darkness basement based on short story fear of the dark;Lights Out;81.0;6.3;1129;David F. Sandberg
72571;Horror;witch sister sister relationship sequel prequel haunting;Paranormal Activity 3;83.0;5.9;669;Henry Joost
242512;Horror;death of a friend swimming pool ouija ouija board teenager;Ouija;89.0;4.9;983;Stiles White
211954;Comedy Drama;bachelor vespa;No se Aceptan Devoluciones;115.0;7.5;205;Eugenio Derbez
82990;Horror;garage poltergeist webcam imaginary friend bathtub;Paranormal Activity 4;95.0;5.2;563;Henry Joost
29912;Drama;crucifixion ancient rome;The Robe;135.0;6.4;42;Henry Koster
11843;Comedy;robbery diamant c\u00f4te d'azur inspector panther;The Return of the Pink Panther;113.0;6.7;137;Blake Edwards
11284;Horror Thriller Comedy;amnesia nightmare alternate dimension psychologist memory loss;Freddy's Dead: The Final Nightmare;89.0;5.1;272;Rachel Talalay
504;Crime Drama;female nudity prostitute rape sexual abuse desperation;Monster;110.0;7.0;485;Patty Jenkins
173;Adventure Drama Science_Fiction;diving ocean submarine jules verne captain;20,000 Leagues Under the Sea;127.0;6.8;157;Richard Fleischer
227348;Horror Thriller;supernatural demon found footage;Paranormal Activity: The Marked Ones;84.0;5.2;449;Christopher B. Landon
1955;Drama History;exploitation biography hospital curiosity sideshow;The Elephant Man;124.0;7.9;719;David Lynch
152532;Drama History;women aids biography based on true story hiv;Dallas Buyers Club;117.0;7.9;2886;Jean-Marc Vall\u00e9e
243940;Thriller Horror;terror experiment afterlife paranormal violence;The Lazarus Effect;83.0;5.1;505;David Gelb
77;Mystery Thriller;individual insulin tattoo waitress amnesia;Memento;113.0;8.1;4028;Christopher Nolan
157547;Horror;hallucination supernatural mirror skepticism ghost;Oculus;104.0;6.3;1050;Mike Flanagan
2295;Comedy;independent film aftercreditsstinger duringcreditsstinger;Clerks II;97.0;6.9;398;Kevin Smith
71;Drama Comedy Music;workers' quarter dancing class strike northern england scholarship;Billy Elliot;110.0;7.4;750;Stephen Daldry
147773;Comedy Drama;shyness beach bicycle conversation friendship;The Way Way Back;103.0;7.1;688;Nat Faxon
16096;Comedy;;House Party 2;94.0;4.7;21;Doug McHenry
24266;Family Drama Action Western Romance;regret river horse ranch australia;The Man from Snowy River;104.0;6.8;37;George T. Miller
16508;Animation Family Comedy;journalism dance daydream friendship pollution;Doug's 1st Movie;77.0;5.4;22;Maurice Joyce
2895;Drama;christianity coma jealousy radio station texas;The Apostle;134.0;6.1;38;Robert Duvall
15660;Drama;ax biography sociopath lawyer mansion;Mommie Dearest;129.0;6.5;54;Frank Perry
59968;Comedy Drama;brother sister relationship sister sister relationship family clan idealist duringcreditsstinger;Our Idiot Brother;90.0;5.9;365;Jesse Peretz
323677;Action Drama;olympic games biography sport historical figure nazi germany;Race;134.0;7.1;478;Stephen Hopkins
19848;Drama;strip club stripper dominatrix cat fight;The Players Club;104.0;6.4;14;Ice Cube
256274;Horror Thriller;paris treasure catacombs scientist singing in a car;As Above, So Below;93.0;6.1;766;John Erick Dowdle
235271;Drama Thriller;infidelity obsession lie sin interracial relationship;Addicted;105.0;5.4;63;Bille Woodruff
45153;Drama;sister sister relationship menstruation superstition independent film curse;Eve's Bayou;109.0;6.1;27;Kasi Lemmons
284293;Drama;mother professor illness;Still Alice;99.0;7.5;1104;Richard Glatzer
24973;History Drama;egypt;The Egyptian;139.0;6.0;11;Michael Curtiz
21610;Action Crime Thriller;;Nighthawks;99.0;6.4;86;Bruce Malmuth
10283;Horror Thriller;new york boat mask psychopath high school;Friday the 13th Part VIII: Jason Takes Manhattan;100.0;4.8;191;Rob Hedden
8346;Comedy Drama Romance;usa parents kids relationship greece culture clash midlife crisis;My Big Fat Greek Wedding;95.0;6.2;671;Joel Zwick
122081;Drama Crime;female nudity sex florida drug dealer nudity;Spring Breakers;94.0;5.0;1551;Harmony Korine
10987;Horror Thriller;mass murder nudity halloween attempt to escape cult;Halloween: The Curse of Michael Myers;88.0;5.0;170;Joe Chappelle
1391;Drama Romance;mexico sex beach group sex male friendship;Y tu mamá también;106.0;7.3;315;Alfonso Cuar\u00f3n
747;Horror Comedy;record collection flower cheese pub surrey;Shaun of the Dead;99.0;7.5;2420;Edgar Wright
14745;Drama Horror;;The Haunting of Molly Hartley;82.0;4.3;48;Mickey Liddell
26748;Drama Mystery Romance;sheriff family secrets neo-western dark secrets;Lone Star;135.0;6.9;77;John Sayles
11357;Horror Thriller;sheriff scissors ambulance halloween twist;Halloween 4: The Return of Michael Myers;88.0;5.9;209;Dwight H. Little
24913;Horror Mystery;island party murder teen movie slasher;April Fool's Day;89.0;5.8;73;Fred Walton
13776;Comedy Drama;diner baltimore maryland fake accident gambling debt twenty something;Diner;110.0;6.9;83;Barry Levinson
14854;Action Crime Drama Romance Thriller;martial arts kung fu texas fbi wheelchair;Lone Wolf McQuade;107.0;5.5;67;Steve Carver
50357;Horror Thriller Science_Fiction;moon nasa infection barbecue moon landing;Apollo 18;86.0;5.0;356;Gonzalo L\u00f3pez-Gallego
13090;Comedy Drama;suicide single parent sister sister relationship cleaning lady new mexico;Sunshine Cleaning;102.0;6.5;255;Christine Jeffs
192141;Action Thriller;hotel revolution race against time engineer coup;No Escape;103.0;6.7;777;John Erick Dowdle
16441;Action Fantasy;sword fight animal;The Beastmaster;118.0;6.0;97;Don Coscarelli
29996;Drama History Romance War;israel egypt religion and supernatural epic;Solomon and Sheba;139.0;5.4;8;King Vidor
351819;Romance Comedy;sex black parody spoof millionaire;Fifty Shades of Black;92.0;4.3;331;Michael Tiddes
14834;Drama Romance;;Not Easily Broken;99.0;6.3;9;Bill Duke
22649;Drama Romance War;italy nurse love letter officer priest;A Farewell to Arms;89.0;6.2;28;Frank Borzage
378200;Comedy Romance;bet match playboy fear of commitment best friend;The Perfect Match;96.0;5.2;42;Bille Woodruff
20455;Fantasy Animation Science_Fiction Family;video game monster loss of energy egg computer;Digimon: The Movie;82.0;6.2;72;Mamoru Hosoda
13193;Comedy Drama;christianity gay coming out independent film coming of age;Saved!;92.0;6.3;147;Brian Dannelly
11042;Comedy Crime Drama;father son relationship socialism yuppie professor dying and death;Les Invasions barbares;99.0;6.7;77;Denys Arcand
10786;Action Adventure Drama Romance;england crusade robin hood king richard;Robin and Marian;106.0;6.6;50;Richard Lester
12484;Action Adventure Horror Thriller;vampire full moon poster hitchhiker homoeroticism;The Forsaken;90.0;4.9;47;J.S. Cardone
17339;Action Adventure War Thriller;gun traitor nazis bridge major;Force 10 from Navarone;118.0;6.4;91;Guy Hamilton
11959;Comedy;loser tv station game show tv star music video;UHF;97.0;6.7;89;Jay Levey
9900;Comedy;video game grandmother grandson relationship man child stoner game tester;Grandma's Boy;94.0;6.6;220;Nicholaus Goossen
14662;Comedy Drama;sex independent film moving beverly hills woman director;Slums of Beverly Hills;91.0;6.5;44;Tamara Jenkins
335;Western;showdown bounty bounty hunter loss of brother sadness;C'era una volta il West;175.0;8.1;1128;Sergio Leone
15745;Action Comedy Thriller;;Made;94.0;6.3;55;Jon Favreau
17431;Science_Fiction Drama;moon artificial intelligence clone isolation future;Moon;97.0;7.6;1794;Duncan Jones
21014;Comedy;bar mitvah party independent film;Keeping Up with the Steins;90.0;5.2;18;Scott Marshall
78394;Documentary;prehistoric dinosaur imax underwater scene 3d;Sea Rex 3D: Journey to a Prehistoric World;41.0;5.9;11;Ronan Chapalain
10217;Drama;canada suffering village paralysis independent film;The Sweet Hereafter;112.0;6.8;103;Atom Egoyan
46332;Drama History;monk sunrise medicine hostage evacuation;Des hommes et des dieux;120.0;6.5;91;Xavier Beauvois
13996;Comedy Drama;wine garden wine winzer;Bottle Shock;110.0;6.6;60;Randall Miller
3028;Comedy Horror Science_Fiction;double life musical jekyll and hyde;Jekyll and Hyde ... Together Again;87.0;4.6;5;Jerry Belson
1024;Drama Fantasy;mother sex secret obsession literature;Heavenly Creatures;99.0;7.0;294;Peter Jackson
343795;Drama;hospital church;90 Minutes in Heaven;121.0;5.4;40;Michael Polish
45658;Comedy Drama Romance;alcohol arizona beer playboy independent film;Everything Must Go;97.0;6.0;208;Dan Rush
16148;Comedy Crime Mystery Thriller;detective blackmail independent film;Zero Effect;116.0;6.0;55;Jake Kasdan
36351;Drama Crime;suicide drug dealer redemption addict existentialism;Light Sleeper;103.0;5.7;15;Paul Schrader
245916;Thriller Crime Drama Mystery;biography;Kill the Messenger;112.0;6.6;355;Michael Cuesta
27585;Drama;loss of son trauma toy marriage grief;Rabbit Hole;91.0;6.9;165;John Cameron Mitchell
1415;Comedy Drama Crime;new york hotel based on novel birthday bath;Party Monster;98.0;5.9;58;Fenton Bailey
313922;Horror Crime Thriller;skinhead heroin music cover-up murder;Green Room;95.0;6.7;683;Jeremy Saulnier
14474;Comedy Drama Romance;sex adultery depression infidelity nightclub;The Oh in Ohio;88.0;5.8;27;Billy Kent
199933;Drama Science_Fiction Mystery;trilogy ayn rand;Atlas Shrugged Part III: Who is John Galt?;99.0;3.9;15;James Manera
13685;Comedy Crime Drama;brother brother relationship robbery burglar language barrier motel;Bottle Rocket;91.0;6.8;281;Wes Anderson
8744;Crime Drama Thriller;brother brother relationship bar gun hostage siege;Albino Alligator;97.0;5.6;45;Kevin Spacey
38428;Drama Foreign History;biography mahatma gandhi tragedy;Gandhi, My Father;136.0;6.0;2;Feroz Abbas Khan
8847;Documentary;prison prisoner jail guard prison cell bagdad;Standard Operating Procedure;117.0;6.6;14;Errol Morris
39269;Drama;punk independent film coming of age teenage girl alcoholic father;Out of the Blue;94.0;6.5;17;Dennis Hopper
46838;Comedy Horror;cabin chainsaw hillbilly body in chipper cut off jeans;Tucker and Dale vs Evil;89.0;7.3;847;Eli Craig
51384;Drama Romance;independent film;Lovely, Still;92.0;6.2;13;Nicholas Fackler
56930;Action Drama Romance;mountains engineer railroad ethics;Tycoon;128.0;6.6;4;Richard Wallace
41730;Comedy Drama;bomb fire fbi quarantine independent film;Desert Blue;90.0;5.5;9;Morgan J. Freeman
18442;Horror Science_Fiction Thriller;;Decoys;95.0;4.7;33;Matthew Hastings
298312;Horror Thriller;rap music pennsylvania brother sister relationship farm grandparents;The Visit;94.0;6.0;1360;M. Night Shyamalan
11600;Drama War;iraq iraq war;Redacted;90.0;6.2;37;Brian De Palma
71547;Romance Thriller;beach murder;Fascination;95.0;3.8;4;Klaus Menzel
57876;Horror Thriller Science_Fiction;found footage area 51;Area 51;91.0;4.2;151;Oren Peli
77495;Thriller;barcelona spain blackmail concierge caretaker stalking;Mientras duermes;107.0;7.0;202;Jaume Balaguer\u00f3
13849;Horror Comedy Crime Thriller;ransom hostage hostage drama;The Cottage;92.0;6.3;80;Paul Andrew Williams
14849;Drama Fantasy Comedy;suicide life and death coma afterlife;Dead Like Me: Life After Death;87.0;5.8;65;Stephen Herek
12486;Comedy Documentary;penguin balzen antarctic;Farce of the Penguins;80.0;3.2;13;Bob Saget
244403;Music Drama Comedy;father son relationship rock band grieving father;Rudderless;105.0;7.4;105;William H. Macy
340816;Romance Comedy;photographer surgeon orchestra doctor car accident;Christmas Eve;95.0;6.1;24;Mitch Davis
78814;TV Movie Crime Drama Thriller;;We Have Your Husband;89.0;5.0;3;Eric Bross
297596;Thriller Drama;cia retirement espionage terrorism;Dying of the Light;94.0;4.5;118;Paul Schrader
299552;Action Thriller War;gun oil secret service woman director mina;Born Of War;109.0;4.1;7;Vicky Jewson
